Entity Type,ID,Title,Status,Priority,Points/Complexity,Parent ID (Epic/Story),Context (Sprint/Value Stream),Assignee,Description
User Story,US-TD5NIIP,Jira Sync UI - Display Sync Status and Manual Controls,backlog,medium,3,,,,"As a user, I need to see which stories are synced with Jira and have the ability to manually trigger sync or disconnect, so I can manage the integration from ARKHITEKTON UI."
User Story,US-T5QNZ82,Outbound Sync - Push ARKHITEKTON Changes to Jira,backlog,medium,3,,,,"As a user, when I update a story in ARKHITEKTON that is linked to Jira, the changes should automatically sync to Jira in real-time, so both systems stay consistent."
User Story,US-SRV4N7Z,ID Mapping Service - Link ARKHITEKTON Stories to Jira Issues,backlog,medium,3,,,,"As a system architect, I need an ID mapping service that maintains relationships between ARKHITEKTON entities and Jira issues, so that each system can keep its own ID format while staying synchronized."
User Story,US-SXLNYIG,Jira Webhook Endpoint - Receive Real-time Issue Updates,backlog,medium,3,,,,"As a platform architect, I need a webhook endpoint that receives Jira issue events in real-time, so that ARKHITEKTON can stay synchronized with changes made in Jira without polling."
User Story,US-I7KM8RT,Jira Webhook Endpoint - Receive Real-time Issue Updates,backlog,medium,3,,,,"As a platform architect, I need a webhook endpoint that receives Jira issue events in real-time, so that ARKHITEKTON can stay synchronized with changes made in Jira without polling."
User Story,US-65R28JC,Webhook Performance & Infrastructure Requirements Assessment,backlog,medium,3,,,,"Assess performance requirements, webhook volume calculations, and infrastructure needs for Jira integration at scale. Design async processing infrastructure."
User Story,US-ZXC4N12,Bi-Directional Sync Architecture with Loop Prevention Design,backlog,medium,3,,,,"Design webhook-based bi-directional sync architecture with loop prevention, conflict resolution, and async queue processing. Create technical architecture for ARKHITEKTON ↔ Jira real-time synchronization."
User Story,US-WZAB7CF,ARKHITEKTON ↔ Jira Field Mapping Design Specification,backlog,medium,3,,,,"Design comprehensive field mapping strategy between ARKHITEKTON entities (user stories, defects, epics) and Jira issues. Create ID mapping table schema and bi-directional sync rules."
User Story,US-ULVW5WM,Jira API Authentication & Connectivity Assessment (Spike),backlog,medium,3,,,,Technical spike to validate Jira Cloud OAuth 2.0 setup and API connectivity. Establish proof-of-concept authentication flow and verify rate limits for bi-directional sync requirements.
User Story,US-TG7MSEQ,White grid background pattern for shape palette popovers,backlog,medium,3,,,,Add a subtle white grid background to shape palette popovers to provide visual context and match professional diagramming tool aesthetics (Miro/Figma style).
User Story,US-OUW0G7W,Canvas back navigation to Design Studio home,backlog,medium,3,,,,"Add a back navigation button in the canvas header to allow users to easily return to the Design Studio home page, improving navigation flow."
User Story,US-K7V595F,Story-to-code traceability schema fields for linking implementation,backlog,medium,3,,,,"Add relatedFiles and documentationPageId fields to user stories schema to enable complete traceability from requirements to code and documentation, supporting the platform's end-to-end traceability vision."
User Story,US-NFBV72R,Miro-style shape palette with icon toolbar and popover panels,backlog,medium,3,,,,"Create an intuitive shape palette system with left-side icon toolbar (like Miro) where clicking an icon reveals a popover with shapes. When user selects or drags a shape, a properties panel opens on the right showing shape categories and options."
User Story,And I should see icons for: Shapes & Lines,Text,backlog,medium,3,,,,Tables
User Story,And I should see basic shapes: Rectangle,Circle,backlog,medium,3,,,,Triangle
User Story,And I should see expandable sections: Basic Shapes,Flowchart,backlog,medium,3,,,,AWS
User Story,US-E3VKUUF,Miro-style shape palette with icon toolbar and popover panels,backlog,medium,3,,,,"Create an intuitive shape palette system with left-side icon toolbar (like Miro) where clicking an icon reveals a popover with shapes. When user selects or drags a shape, a properties panel opens on the right showing shape categories and options."
User Story,US-GJOLEUT,Empty state onboarding experience for first-time users,backlog,medium,3,,,,Create an engaging empty state for users with no diagrams that guides them to create their first architecture model with clear CTAs and visual guidance.
User Story,US-AKCVWDP,Real-time collaboration indicators showing online presence and activity,backlog,medium,3,,,,Display live collaboration indicators showing who is viewing/editing diagrams with online status badges and activity feeds - inspired by Miros multiplayer features.
User Story,US-4VRY5C1,Template gallery modal with search and framework filtering,backlog,medium,3,,,,"Create a comprehensive template browser modal with search, framework tabs, and visual previews for discovering architecture diagram templates."
User Story,And I should see framework tabs: All,AWS,backlog,medium,3,,,Data Model,Azure
User Story,US-ZONAVI1,Progressive disclosure system adapting to user expertise level,backlog,medium,3,,,,Implement intelligent UI that starts simple for beginners and progressively reveals advanced features as users gain experience - applying UX Agents progressive disclosure patterns.
User Story,US-SZS7K1W,My Diagrams table view with advanced filtering and sorting,backlog,medium,3,,,,"Implement a powerful table view for diagram management with filters, sorting, and collaboration indicators - inspired by Miros board management interface."
User Story,"And table should support infinite scroll or pagination for 50+ diagrams,8,backlog,medium,,,,Sortable table with columns for name",framework,backlog,medium,3,,,,modified date
User Story,US-O7RYWLN,Framework category cards for intuitive template discovery,backlog,medium,3,,,,"Create colorful framework category cards (AWS, Azure, ArchiMate, BPMN, etc.) that help users discover templates by architecture framework - inspired by Murals role-based discovery."
User Story,And cards should display: AWS (orange),Azure (blue),backlog,medium,3,,,Custom (gradient),ArchiMate (purple)
User Story,US-IW8NJ38,Recent diagrams section with Figma-style visual cards and metadata,backlog,medium,3,,,,"Display recently accessed diagrams as beautiful cards with thumbnail previews, metadata, and quick actions - inspired by Figmas project gallery."
User Story,And cards should show: title,framework badge,backlog,medium,3,,,,last modified time
User Story,And hovering a card should reveal actions: Star,Duplicate,backlog,medium,3,,,,Share
User Story,And cards should display in a responsive grid (3 columns desktop,2 tablet,backlog,medium,3,,,,"1 mobile),8,backlog,high,,,,Visual diagram cards with thumbnails"
User Story,US-IFRR2W3,Develop AI-powered suggested connections feature,backlog,medium,3,,,,Leverage AI to intelligently propose relevant relationships between elements based on patterns and best practices.
User Story,US-E9KJJNU,Implement search and filter mechanism for diagram elements,backlog,medium,3,,,,Provide powerful search and filtering capabilities to quickly find and navigate elements in complex diagrams.
User Story,US-A4PXXCU,Introduce real-time collaboration features for simultaneous diagram editing,backlog,medium,3,,,,Enable multiple architects to work on the same diagram simultaneously with live updates and conflict resolution.
User Story,US-5WWAHII,Add version control for diagram states with rollback capability,backlog,medium,3,,,,Enable architects to save diagram versions and revert to previous states for iterative design.
User Story,US-1C82LW9,Enhance existing element templates with customizable properties,backlog,medium,3,,,,Extend standard architecture elements with custom properties and metadata fields for organization-specific needs.
User Story,And I should be able to add new custom properties with types (text,number,backlog,medium,3,,,,date
User Story,US-XN7S0SO,Add export functionality for palette configurations,backlog,medium,3,,,,Allow architects to export and share custom palette configurations for team consistency.
User Story,US-TOSXO2V,Implement element relationship validation and guidance,backlog,medium,3,,,,Provide intelligent validation and guidance when connecting architecture elements to ensure model correctness.
User Story,US-KQJDE22,Add custom element creation and editing capabilities,backlog,medium,3,,,,Enable architects to create and edit custom architecture elements beyond standard templates for unique modeling needs.
User Story,US-Z3PQ5WU,Develop AI-powered suggested connections feature,backlog,medium,3,,,,Leverage AI to intelligently propose relevant relationships between elements based on patterns and best practices.
User Story,US-V9O380L,Implement search and filter mechanism for diagram elements,backlog,medium,3,,,,Provide powerful search and filtering capabilities to quickly find and navigate elements in complex diagrams.
User Story,US-RBCO5NS,Introduce real-time collaboration features for simultaneous diagram editing,backlog,medium,3,,,,Enable multiple architects to work on the same diagram simultaneously with live updates and conflict resolution.
User Story,US-MZMD3NE,Add version control for diagram states with rollback capability,backlog,medium,3,,,,Enable architects to save diagram versions and revert to previous states for iterative design.
User Story,US-ILEGPEZ,Enhance existing element templates with customizable properties,backlog,medium,3,,,,Extend standard architecture elements with custom properties and metadata fields for organization-specific needs.
User Story,US-F32RFPQ,Add export functionality for palette configurations,backlog,medium,3,,,,Allow architects to export and share custom palette configurations for team consistency.
User Story,US-BHL59LO,Implement element relationship validation and guidance,backlog,medium,3,,,,Provide intelligent validation and guidance when connecting architecture elements to ensure model correctness.
User Story,US-7E03YY9,Add custom element creation and editing capabilities,backlog,medium,3,,,,Enable architects to create and edit custom architecture elements beyond standard templates for unique modeling needs.
User Story,US-XJ93K05,Add IBM Cloud icons to multi-vendor library,backlog,medium,3,,,,Integrate IBM Cloud architecture icons from official GitHub repository to expand cloud provider coverage to four major vendors
User Story,Then Build main diagram canvas component using react-konva. Implement layer management system (background,objects,backlog,medium,3,,,,connections
User Story,Then successfully download 50 IBM icons,update manifest,backlog,medium,3,,,,add IBM vendor filtering
User Story,US-TGFLIX6,Add Cloud Icons navigation menu item,backlog,medium,3,,,,Update navigation sidebar to include Cloud Icons menu item for easy access to the multi-vendor icon library
User Story,US-QR6E2J2,Create cloud icons gallery page with vendor filtering,backlog,medium,3,,,,Build comprehensive gallery UI to browse and search 200+ cloud architecture icons with vendor-specific filtering and color-coded categorization
User Story,Then display all icons in responsive grid with search,vendor tabs (All/GCP/AWS/Azure/IBM),backlog,medium,3,,,,color-coded badges
User Story,US-OJ3NDJN,Build automated idempotent cloud icon download script,backlog,medium,3,,,,"Create Node.js script to download cloud icons from multiple vendor sources (GitHub repos, CDNs) with idempotent behavior for reliable CI/CD integration"
User Story,US-JJ75ZYK,Research and implement multi-vendor cloud icon library,backlog,medium,3,,,,"Expand beyond single-vendor GCP icons to support multiple cloud providers (AWS, Azure, GCP, IBM) for comprehensive architecture modeling capabilities"
User Story,When researching official icon sources for AWS,Azure,backlog,medium,3,,,,GCP
User Story,US-BGQ0E18,Research and implement multi-vendor cloud icon library,backlog,medium,3,,,,"Expand beyond single-vendor GCP icons to support multiple cloud providers (AWS, Azure, GCP, IBM) for comprehensive architecture modeling capabilities"
User Story,US-f5ec11c,Customizable keyboard shortcuts for common actions,backlog,medium,3,,,,"As a power user, I want to customize keyboard shortcuts so that I can work more efficiently with my preferred key bindings."
User Story,And shortcuts should be grouped by category (Canvas,Elements,backlog,medium,3,,,,View
User Story,US-0ba9d52,Dark mode toggle for improved night-time viewing,backlog,medium,3,,,,"As a user working at night, I want to switch to dark mode so that I can reduce eye strain and work comfortably in low-light conditions."
User Story,US-0ba60ad,Drag-and-drop feature to rearrange diagram elements,backlog,medium,3,,,,"As a designer, I want to drag and drop elements on the canvas so that I can easily rearrange and organize my architectural diagrams."
User Story,US-35fe1e6,Quick Start guide with interactive tooltips for new users,backlog,medium,3,,,,"As a new user, I want an interactive Quick Start guide so that I can quickly learn how to use the platform effectively."
User Story,US-a85a590,Dynamic loading indicators for smoother user experience,backlog,medium,3,,,,"As a user, I want to see dynamic loading indicators so that I know the system is processing my requests and not frozen."
User Story,US-6e0c38b,Mini-map navigation for large architectural models,backlog,medium,3,,,,"As an architect working with complex diagrams, I want a mini-map overview so that I can quickly navigate to different areas of large models."
User Story,US-fbcc0a6,Smart grid snapping tool for precise element alignment,backlog,medium,3,,,,"As a designer, I want elements to snap to a grid so that I can create precisely aligned architectural diagrams."
User Story,US-abe0ab7,User-friendly undo/redo functionality for canvas actions,backlog,medium,3,,,,"As a design studio user, I want to undo and redo my canvas actions so that I can easily correct mistakes and experiment with designs."
User Story,US-1359d33,Add export functionality for palette configurations,backlog,medium,3,,,,"As a design studio user, I want to export my custom palette configurations so that I can share them with my team or use them in other projects."
User Story,US-056d222,Implement element relationship validation and guidance,backlog,medium,3,,,,"As an architect, I want the system to validate element relationships so that I create architecturally sound diagrams following best practices."
User Story,US-508b88b,Add custom element creation and editing capabilities,backlog,medium,3,,,,"As a design studio user, I want to create and edit custom architecture elements so that I can represent unique concepts not available in the standard library."
User Story,And the user can define element name,shape,backlog,medium,3,,,,color
User Story,US-UI-099,Consolidate Modeling Pages into Unified Design Studio,backlog,medium,3,,,,"Consolidate Architecture Modeling, Architecture Workspace, and Design Palette into one unified Design Studio page that serves as the single destination for all modeling and design work."
User Story,THEN I should see a comprehensive modeling workspace with palette,canvas,backlog,medium,3,,,,properties
User Story,US-UI-095,Apply GovernanceHeader to Knowledge Base & Ticket Pages,backlog,medium,3,,,,"Update Wiki/Knowledge Base and all Ticket pages (list, create, edit, view) to use the new GovernanceHeader component"
User Story,US-UI-097,Apply GovernanceHeader to Design & Architecture Pages,backlog,medium,3,,,,"Update all Design Options and ARKHITEKTON Architecture pages (AWS, Azure, GCP, Oracle) to use the new GovernanceHeader component"
User Story,US-TM028,Add Task Date Management,backlog,medium,3,,,,Start/end dates with calendar picker and validation for project scheduling
User Story,US-UI-093,Implement GovernanceHeader Component & Complete Sidebar Navigation,backlog,medium,3,,,,"Create a reusable GovernanceHeader component for consistent navigation and branding across all pages, and ensure all pages have the left sidebar navigation (AppLayout wrapper) for complete navigation coverage."
User Story,THEN I should see a consistent header with ARKHITEKTON branding,module title,backlog,medium,3,,,,breadcrumb navigation
User Story,US-UI-096,Apply GovernanceHeader to Portfolio & Business Pages,backlog,medium,3,,,,"Update Application Portfolio, Business Capabilities, and Business Workflows pages to use the new GovernanceHeader component"
User Story,US-UI-094,Apply GovernanceHeader to Governance & Decision Pages,backlog,medium,3,,,,Update Governance and Architecture Decision Records pages to use the new GovernanceHeader component for consistent navigation
User Story,- User browses available themes (e.g.,Ocean Blue,backlog,medium,3,,,,Forest Green
User Story,- User defines element properties (name,type,backlog,medium,3,,,,visual appearance
User Story,US-8FOHUZ5,Design Canvas Integration,backlog,medium,3,,,,"Connect documentation to live architecture diagrams, embed models, sync design changes, and create living documentation"
User Story,Then Connect documentation to live architecture diagrams,embed models,backlog,medium,3,,,,sync design changes
User Story,US-8BN7VGQ,Content Organization System,backlog,medium,3,,,,"Implement hierarchical page structure with categories, tags, and advanced search capabilities"
User Story,US-87KGW18,Context-Aware Help Bubbles,backlog,medium,3,,,,"Smart help tooltips and guidance that appear based on current user actions, selected elements, and workflow context. Provides just-in-time assistance."
User Story,US-83GUW0H,Dynamic Element Preview Pane,backlog,medium,3,,,,"Real-time preview of how architecture elements will look and behave before placing them on the canvas. Shows element properties, styling, and interaction hints."
User Story,US-7Z86IPQ,Themed Palette Switcher,backlog,medium,3,,,,"Multiple visual themes for the component palette including light/dark modes, color schemes, and customizable styling options for different user preferences."
User Story,US-7V12LME,Shape Configuration Panel & Dynamic Properties,backlog,medium,3,,,,"Build properties panel that appears when shape is selected. Implement dynamic form generation based on shape type, real-time property updates, and validation for required properties."
User Story,US-7QU6OQG,Drag-Drop Functionality,backlog,medium,3,,,,Intuitive drag-drop with magnetic snap-to-grid
User Story,US-7MRUJZI,Canvas Navigation & Viewport Controls,backlog,medium,3,,,,"Build smooth zoom and pan functionality, minimap for large diagrams, viewport bounds management, zoom-to-fit features, and navigation controls for enterprise-scale architecture diagrams."
User Story,Then Build smooth zoom and pan functionality,minimap for large diagrams,backlog,medium,3,,,,viewport bounds management
User Story,US-7IN4LYX,Comprehensive Storage & API Framework,backlog,medium,3,,,,"Enterprise-grade backend infrastructure with dual storage strategies (memory/database), RESTful API, Drizzle ORM integration, schema management, and comprehensive CRUD operations across all platform entities."
User Story,Then Enterprise-grade backend infrastructure with dual storage strategies (memory/database),RESTful API,backlog,medium,3,,,,Drizzle ORM integration
User Story,US-7EJV435,Rich Text Editor Implementation,backlog,medium,3,,,,"Build Confluence-like editor with real-time collaboration, version control, and advanced formatting"
User Story,US-79Y3MTI,Knowledge Base Core System & Documentation Platform,backlog,medium,3,,,,"Enterprise documentation platform with rich text editing, hierarchical navigation, template system, collaboration features, and integration with architecture modeling for living documentation."
User Story,Then Enterprise documentation platform with rich text editing,hierarchical navigation,backlog,medium,3,,,,template system
User Story,US-75TA6QI,AI Intelligence Platform & Recommendation Engine,backlog,medium,3,,,,"Comprehensive AI-powered architecture intelligence system featuring Claude integration, recommendation engine, change detection, pattern recognition, and intelligent assistance for enterprise architecture decision-making."
User Story,Then Comprehensive AI-powered architecture intelligence system featuring Claude integration,recommendation engine,backlog,medium,3,,,,change detection
User Story,US-70YIBBA,AI-Powered Analysis Engine,backlog,medium,3,,,,"Implement Claude integration for architectural insights, pattern recognition, and recommendations"
User Story,US-6WUJ65L,Visual Modeling Engine,backlog,medium,3,,,,"Build drag-and-drop modeling interface with ArchiMate, BPMN, and cloud architecture support"
User Story,US-6SR9DV7,Enterprise UI Component Library & Design System,backlog,medium,3,,,,"Comprehensive shadcn/ui-based component library with accessibility, theming, responsive design, and enterprise-grade user experience across all application areas."
User Story,US-TM026,Create Task Comments System,backlog,medium,3,,,,"Add, edit, delete comments with timestamps and user attribution"
User Story,Then Comprehensive shadcn/ui-based component library with accessibility,theming,backlog,medium,3,,,,responsive design
User Story,US-6ONFEU9,Advanced Properties & Metadata Management System,backlog,medium,3,,,,"Sophisticated object property editing system with inline editing, metadata management, relationship tracking, semantic modeling, and enterprise governance integration."
User Story,Then Sophisticated object property editing system with inline editing,metadata management,backlog,medium,3,,,,relationship tracking
User Story,US-6KJ9799,Comprehensive Element Palette & Catalog System,backlog,medium,3,,,,"Enterprise-grade element library with AWS, Azure, GCP, ArchiMate, and BPMN components, featuring drag-and-drop functionality, categorization, search, and visual representation system."
User Story,Then Enterprise-grade element library with AWS,Azure,backlog,medium,3,,,search,GCP
User Story,US-6G9IEA8,Visual Modeling Workspace Platform,backlog,medium,3,,,,"Comprehensive drag-and-drop visual modeling interface supporting ArchiMate, BPMN, and cloud architecture with advanced canvas controls, object management, and interactive modeling capabilities."
User Story,Then Comprehensive drag-and-drop visual modeling interface supporting ArchiMate,BPMN,backlog,medium,3,,,,and cloud architecture with advanced canvas controls
User Story,US-6C31AFR,Visual Data Flow Animator,backlog,medium,3,,,,Animated visualization showing how data flows through architecture diagrams. Helps architects understand system interactions and data movement patterns.
User Story,US-67YCCWD,Interactive Relationship Suggester,backlog,medium,3,,,,"AI-powered intelligent suggestions for how architecture components should connect based on best practices, patterns, and contextual analysis."
User Story,US-63TPL3I,APM Integration Framework,backlog,medium,3,,,,"Build integration capabilities with CMDB, service catalogs, and enterprise architecture tools"
User Story,US-5ZPA5KD,Portfolio Analytics & Intelligence Dashboard,backlog,medium,3,,,,"Create comprehensive analytics dashboard with AI insights, recommendations, and portfolio optimization"
User Story,US-5VMB6TJ,Business Capability Mapping Intelligence,backlog,medium,3,,,,Build AI-powered mapping between applications and business capabilities using the 313-record maturity model
User Story,US-5RHN3PC,AI Application Discovery Engine,backlog,medium,3,,,,Implement automated network scanning and HTTP service detection for application discovery
User Story,US-5NC24XI,Data Classification & Security Framework,backlog,medium,3,,,,"Build data type classification, security levels, and compliance requirements mapping for applications"
User Story,US-5J8SKL3,Regional Deployment Tracking,backlog,medium,3,,,,"Implement global deployment tracking with regional configuration, status assignment, and timeline visualization"
User Story,US-5F4XZRT,Application Versioning System,backlog,medium,3,,,,"Build comprehensive version management with history tracking, planned versions, and status transitions"
User Story,US-5B0WFW5,Application Metadata Management System,backlog,medium,3,,,,"Implement technology type dropdowns, custom fields configuration, business owner assignment, and status tracking"
User Story,Then Implement technology type dropdowns,custom fields configuration,backlog,medium,3,,,,business owner assignment
User Story,US-56XZ76B,Application CRUD Operations Foundation,backlog,medium,3,,,,"Create comprehensive application creation, read, update, delete operations with validation and database persistence"
User Story,Then Create comprehensive application creation,read,backlog,medium,3,,,,update
User Story,US-52SJFS7,Mobile & Responsive Design,backlog,medium,3,,,,Optimize platform for mobile devices with touch interactions and responsive layouts
User Story,US-4YN8IH6,Collaboration Features,backlog,medium,3,,,,"Build real-time collaboration with live cursors, comments, version control, and team workspaces"
User Story,Then Build real-time collaboration with live cursors,comments,backlog,medium,3,,,,version control
User Story,US-4UHU0Q9,Advanced Visualization Engine,backlog,medium,3,,,,"Implement 3D modeling, interactive dashboards, and advanced chart generation capabilities"
User Story,US-4QFRU8I,API Ecosystem Development,backlog,medium,3,,,,"Create comprehensive API ecosystem with webhooks, SDK, and third-party integrations"
User Story,US-4MBZEBO,Code-Architecture Synchronization,backlog,medium,3,,,,Implement bidirectional sync between architectural models and codebase with IDE plugins
