Entity Type,ID,Title,Status,Priority,Points/Complexity,Parent ID (Epic/Story),Context (Sprint/Value Stream),Assignee,Description
User Story,US-TM024,Implement Task Filtering System,done,high,5,,,,Multi-criteria filtering with search functionality and saved filter presets
User Story,US-TM021,Build Kanban Board Layout,done,high,5,,,,"Column-based layout with status groupings (backlog, in-progress, review, done)"
User Story,US-TM019,Create Task Edit Functionality,done,high,5,,,,"In-place editing with validation and persistence, supporting all task fields"
User Story,US-TM016,Create Task Form with Validation,done,high,5,,,,"Form inputs, Zod validation, error handling for task creation with all required fields"
User Story,US-TM018,Add Task Detail View,done,medium,3,,,,"Full task information display with metadata, comments, and related information"
User Story,US-TM017,Implement Task List View,done,high,3,,,,"Basic list display with status indicators, priority, and assignee information"
User Story,US-TM020,Implement Task Deletion,done,medium,2,,,,Delete confirmation and cleanup with dependency impact analysis
User Story,US-WS013,Add Canvas Object Layering,backlog,low,3,,,,"Z-index management, bring-to-front/send-to-back functionality"
User Story,US-WS009,Implement Canvas Mode Switching,done,medium,3,,,,"Select, pan, connect, annotate modes with mode indicators and cursor changes"
User Story,US-WS012,Implement Canvas Viewport Management,done,medium,3,,,,"Viewport bounds, infinite canvas, and viewport indicators for large models"
User Story,US-WS011,Create Workspace Save/Load,done,high,5,,,,Persist workspace state with JSON serialization and restore capability
User Story,US-WS014,Create Canvas Grid & Snapping,backlog,medium,3,,,,"Visual grid, snap-to-grid functionality, and grid toggle controls"
User Story,US-WS008,Add Canvas Connection Tools,in-progress,high,8,,,,Visual connection creation between objects with different line types and routing
User Story,US-WS007,Create Drag & Drop Object Movement,in-progress,high,5,,,,Object dragging with snap-to-grid and collision detection for precise positioning
User Story,US-WS006,Implement Touch Gesture Support,done,medium,8,,,,"Multi-touch pinch-to-zoom, touch pan, and gesture recognition for mobile/tablet"
User Story,US-WS005,Build Viewport Pan & Zoom Controls,done,high,5,,,,"Mouse/touch pan, zoom in/out, and viewport state management for large diagrams"
User Story,US-WS002,Implement Workspace State Management,done,high,5,,,,"Manage object arrays, connections, viewport state, and undo/redo history"
User Story,US-WS004,Implement Object Selection System,done,high,3,,,,"Multi-select, selection indicators, and selection state management"
User Story,US-WS003,Add Object Creation & Positioning,done,high,5,,,,Add objects to workspace with position and size management from palette drag-drop
User Story,US-WS001,Create Workspace Container Component,done,high,3,,,,Build basic workspace layout with toolbar integration and responsive design
User Story,US-PDF-002,Bulk Export User Stories as PDF,backlog,medium,8,EPIC-UAW,,,"As a product manager, I want to export multiple user stories as a single PDF document so that I can share sprint planning documentation or epic summaries with the team."
User Story,US-DEFECT-003,Advanced Defect Filtering & Search,backlog,high,3,EPIC-DEFECT,,,"As a QA Manager, I want advanced filtering and search capabilities so that I can quickly find specific defects and create custom views for different workflows.

**Context:**
US-DEFECT-001 provides basic single-select filters. This story adds:
- Multi-select filters (e.g., show Critical AND High severity)
- Saved filter presets (e.g., ""My Critical Defects"")
- Free-text search across title and description
- Compound filters (multiple criteria at once)

**Part of:** EPIC-DEFECT Phase 1 (Foundation)"
User Story,US-PDF-003,Customize PDF Header Layout and Branding,backlog,low,5,EPIC-UAW,,,"As a platform administrator, I want to customize the PDF header layout and branding so that exported documents align with our organization's standards and visual identity."
User Story,US-PDF-004,Export Epic with All Related Stories as PDF Report,backlog,high,13,EPIC-UAW,,,"As a product manager, I want to export an entire epic with all its related user stories as a comprehensive PDF report so that I can provide stakeholders with a complete view of the value stream."
User Story,US-PDF-005,Include Attachments and Screenshots in PDF Export,backlog,medium,5,EPIC-UAW,,,"As a product manager, I want to include story attachments and screenshots in the PDF export so that all relevant context is preserved in the exported document."
User Story,US-PDF-006,Print User Stories Directly from Browser,backlog,medium,3,EPIC-UAW,,,"As a user, I want to print user stories directly from my browser with optimized formatting so that I can quickly create physical copies for workshops or wall boards."
User Story,US-PDF-001,Export Single User Story as PDF,done,high,5,EPIC-UAW,,,"As a product manager, I want to export a single user story as a PDF document so that I can share it with stakeholders, include it in presentations, or maintain offline documentation."
User Story,US-PRINT-002,Optimize Print CSS for Story Dialog,done,high,5,EPIC-UAW,,,"As a developer, I want to create print-specific CSS styles that match the PDF template so that printed stories have the same professional appearance as exported PDFs."
User Story,US-PRINT-003,Print Multiple User Stories in Batch,backlog,medium,8,EPIC-UAW,,,"As a product manager, I want to print multiple selected user stories in a single print job so that I can efficiently create physical copies for sprint planning sessions."
User Story,US-PRINT-004,Print Settings and Layout Options,backlog,low,5,EPIC-UAW,,,"As a user, I want to customize print settings before printing so that I can optimize the output for my specific printer and paper size."
User Story,US-PRINT-005,Print Epic Summary with All Related Stories,backlog,medium,8,EPIC-UAW,,,"As a product manager, I want to print an epic summary with all its related user stories so that I can provide comprehensive documentation for stakeholder reviews."
User Story,US-PRINT-006,Quick Print Button in Story Card,backlog,low,3,EPIC-UAW,,,"As a user, I want a quick print button directly on story cards so that I can print stories without opening the edit dialog."
User Story,US-PRINT-001,Print Single User Story to Local/Network Printer,done,high,3,EPIC-UAW,,,"As a product manager, I want to print a user story to my local or network printer with professional formatting so that I can use physical copies for sprint planning, wall boards, or stakeholder meetings."
User Story,US-AI-AGENT-006,Defect Management System - Foundation (See EPIC-DEFECT for full roadmap),in-progress,medium,3,,,,"As a QA Agent, I want a comprehensive defect management system so that quality issues are tracked, analyzed, and resolved systematically.

**⚠️ NOTE: This story is now part of a larger initiative.**

This story represents the original foundation work. The complete Defect Management System is being implemented across 24 user stories in 5 phases:

**Phase 1 - Foundation (Sprints 1-2): 15 points**
- US-DEFECT-001: Defect List View
- US-DEFECT-002: Defect Detail Page
- US-DEFECT-003: Advanced Filtering
- US-DEFECT-004: Defect Export (PDF/CSV)

**Phase 2 - Lifecycle (Sprints 3-4): 17 points**
- US-DEFECT-005: Triage Queue
- US-DEFECT-006: Verification Workflow
- US-DEFECT-007: Defect Templates
- US-DEFECT-008: Rejection Reasons
- US-DEFECT-009: Duplicate Detection

**Phase 3 - Analytics (Sprints 5-6): 29 points**
- US-DEFECT-010: Quality Dashboard
- US-DEFECT-011: Defect Trend Analysis
- US-DEFECT-012: Component Heatmap
- US-DEFECT-013: Defect Aging Report
- US-DEFECT-014: Quality Gates

**Phase 4 - Intelligent Linking (Sprints 7-8): 29 points**
- US-DEFECT-015: Test Case Linking
- US-DEFECT-016: Architecture Component Linking (UNIQUE DIFFERENTIATOR)
- US-DEFECT-017: Source Code Linking
- US-DEFECT-018: Release Version Tagging
- US-DEFECT-019: Auto-Defect from Failed Tests

**Phase 5 - AI Enhancement (Sprints 9+): 42 points**
- US-DEFECT-020: AI Duplicate Detection
- US-DEFECT-021: Root Cause Library
- US-DEFECT-022: AI Severity Suggestion
- US-DEFECT-023: Defect Pattern Recognition
- US-DEFECT-024: Predictive Defect Analytics

**Total Effort:** 140 story points across 24 stories

**See Also:**
- docs/ARKDL-0012-Defect-Management-Vision.md (Complete Product Vision)
- docs/Defect-Management-Gap-Analysis.md (Research & Competitive Analysis)

**Current Implementation Status:**
The existing DefectManagement component provides basic CRUD and story-blocking logic. This is the MVF (Minimum Viable Feature). The roadmap above transforms it into a true Quality Command Center."
User Story,US-IDE-001,Six-Zone IDE Layout Shell,backlog,high,8,EPIC-IDE-01,,,"As a technology architect, I want the Design IDE to display a six-zone layout when I click '+New Model' so that I have a familiar, VS Code-style workspace for modeling."
User Story,US-IDE-002,Activity Bar Navigation,backlog,high,5,EPIC-IDE-01,,,"As a technology architect, I want to navigate between IDE views using the Activity Bar so that I can quickly switch contexts without losing my place."
User Story,US-IDE-003,Resizable Sidebar Panels,backlog,medium,5,EPIC-IDE-01,,,"As a technology architect, I want to resize sidebar panels by dragging their edges so that I can customize my workspace for different tasks."
User Story,US-IDE-004,Multi-Tab Model Editor,backlog,high,8,EPIC-IDE-01,,,"As a technology architect, I want to open multiple models in tabs so that I can work on related diagrams simultaneously without losing context."
User Story,US-IDE-005,Command Palette Core,backlog,high,8,EPIC-IDE-01,,,"As a technology architect, I want to access all IDE commands through a searchable palette so that I can quickly execute actions without navigating menus."
User Story,US-IDE-006,Theme Switching,backlog,low,5,EPIC-IDE-01,,,"As a technology architect, I want to switch between light and dark themes so that I can work comfortably in different lighting conditions."
User Story,US-CVS-001,Infinite Canvas Pan and Zoom,backlog,high,8,EPIC-IDE-02,,,"As a technology architect, I want to pan and zoom on an infinite canvas so that I can navigate large architecture diagrams smoothly."
User Story,US-CVS-002,Grid and Snap System,backlog,high,5,EPIC-IDE-02,,,"As a technology architect, I want elements to snap to a grid so that I can create well-aligned, professional diagrams."
User Story,US-WIKI-006,Duplicate Wiki Pages,backlog,low,3,EPIC-WIKI-01,,,"As an architect, I want to duplicate existing wiki pages so that I can reuse content structures and templates."
User Story,US-CVS-003,Smart Alignment Guides,backlog,medium,5,EPIC-IDE-02,,,"As a technology architect, I want smart alignment guides to appear when moving elements so that I can easily align components with each other."
User Story,US-CVS-004,Element Drag and Drop,backlog,high,8,EPIC-IDE-02,,,"As a technology architect, I want to drag elements from the palette onto the canvas so that I can quickly build diagrams."
User Story,US-CVS-005,Element Resize and Rotate,backlog,high,5,EPIC-IDE-02,,,"As a technology architect, I want to resize and rotate elements so that I can customize their appearance for my diagrams."
User Story,US-CVS-006,Connection Creation,backlog,high,10,EPIC-IDE-02,,,"As a technology architect, I want to create connections between elements so that I can show relationships and data flows."
User Story,US-CVS-007,Undo/Redo System,backlog,high,8,EPIC-IDE-02,,,"As a technology architect, I want to undo and redo my actions so that I can safely experiment and recover from mistakes."
User Story,US-CVS-008,Multi-Selection Operations,backlog,high,5,EPIC-IDE-02,,,"As a technology architect, I want to select multiple elements and perform bulk operations so that I can efficiently organize my diagrams."
User Story,US-CVS-009,Export to PNG/SVG/PDF,backlog,medium,5,EPIC-IDE-02,,,"As a technology architect, I want to export my diagrams as images so that I can include them in presentations and documents."
User Story,US-PAL-002,Element Search,backlog,high,5,EPIC-IDE-03,,,"As a technology architect, I want to search for elements by name or tag so that I can quickly find specific components."
User Story,US-PAL-003,Favorites and Recents,backlog,medium,3,EPIC-IDE-03,,,"As a technology architect, I want quick access to my favorite and recently used elements so that I can work faster."
User Story,US-AGT-001,AI Chat Panel UI,backlog,high,5,EPIC-IDE-04,,,"As a technology architect, I want an AI chat panel in the Secondary Sidebar so that I can have conversations with the AI assistant."
User Story,US-AGT-002,AI Context Awareness - Canvas State,backlog,high,8,EPIC-IDE-04,,,"As a technology architect, I want the AI to understand my current canvas state so that its suggestions are relevant to my work."
User Story,US-AGT-003,AI Context Awareness - Selection Focus,backlog,high,5,EPIC-IDE-04,,,"As a technology architect, I want the AI to focus on my selected elements when I ask questions so that I get targeted advice."
User Story,US-AGT-004,Inline AI Prompt (Cmd+K),backlog,high,8,EPIC-IDE-04,,,"As a technology architect, I want to invoke AI directly on the canvas with Cmd+K so that I can get quick assistance without leaving my workflow."
User Story,US-AGT-005,AI Element Generation,backlog,high,10,EPIC-IDE-04,,,"As a technology architect, I want AI to generate elements from natural language so that I can quickly build diagrams by describing what I need."
User Story,US-AGT-006,AI Explain Selection,backlog,medium,5,EPIC-IDE-04,,,"As a technology architect, I want AI to explain selected architecture components so that I can document and understand my designs."
User Story,US-AGT-014,Agent Mode Dropdown,backlog,high,5,EPIC-IDE-04,,,"As a technology architect, I want to select an Agent Mode from a dropdown so that I can control how the AI responds to my requests."
User Story,US-AGT-015,Auto Mode Routing,backlog,high,8,EPIC-IDE-04,,,"As a technology architect, I want Auto mode to intelligently route my prompts so that I get the right type of response without manually selecting modes."
User Story,US-AGT-016,Scenarios Mode - Pattern Options,backlog,high,10,EPIC-IDE-04,,,"As a technology architect, I want Scenarios mode to generate multiple architecture alternatives so that I can compare options before committing to a design."
User Story,US-AGT-007,Execute Mode Toggle,backlog,medium,3,EPIC-IDE-04,,,"As a technology architect, I want Execute mode to be available via the dropdown so that I can make canvas changes with approval workflow."
User Story,US-AGT-008,Execute Mode Multi-Step Planning,backlog,medium,10,EPIC-IDE-04,,,"As a technology architect, I want Execute mode to show me its plan before executing so that I understand and approve what it will do."
User Story,US-AGT-009,Execute Mode Diff View,backlog,medium,10,EPIC-IDE-04,,,"As a technology architect, I want to see a diff view of Execute mode changes before applying them so that I can review and approve modifications."
User Story,US-AGT-010,Specialized Agent - Security Architect,backlog,medium,8,EPIC-IDE-04,,,"As a technology architect, I want to invoke a Security Architect agent so that I get specialized security analysis and recommendations."
User Story,US-AGT-011,Specialized Agent - Data Architect,backlog,medium,8,EPIC-IDE-04,,,"As a technology architect, I want to invoke a Data Architect agent so that I get specialized data modeling and governance advice."
User Story,US-AGT-012,Specialized Agent - Cloud Architect,backlog,medium,8,EPIC-IDE-04,,,"As a technology architect, I want to invoke a Cloud Architect agent so that I get specialized cloud infrastructure guidance."
User Story,US-AGT-013,Agent Auto-Routing,backlog,low,5,EPIC-IDE-04,,,"As a technology architect, I want the AI to automatically route my questions to the appropriate specialized agent so that I get expert answers without knowing which agent to invoke."
User Story,US-VAL-001,Real-time Validation Engine,backlog,high,8,EPIC-IDE-05,,,"As a technology architect, I want real-time validation of my diagrams so that I catch errors and maintain quality standards."
User Story,US-VAL-002,Problems Panel Display,backlog,high,5,EPIC-IDE-05,,,"As a technology architect, I want to see all validation issues in a Problems Panel so that I can systematically address them."
User Story,US-VAL-003,Quick Fix Actions,backlog,medium,8,EPIC-IDE-05,,,"As a technology architect, I want quick fix suggestions for validation issues so that I can resolve problems efficiently."
User Story,US-WIKI-002,View List of Wiki Pages,backlog,high,3,EPIC-WIKI-01,,,"As an architect, I want to see a list of all my wiki pages so that I can quickly find and access my documentation."
User Story,US-WIKI-003,Edit Existing Wiki Pages,backlog,high,5,EPIC-WIKI-01,,,"As an architect, I want to edit existing wiki pages so that I can update and improve my documentation over time."
User Story,US-WIKI-004,Delete Wiki Pages with Confirmation,backlog,high,3,EPIC-WIKI-01,,,"As an architect, I want to delete wiki pages with a confirmation step so that I can remove outdated documentation safely."
User Story,US-WIKI-020,Insert Block Quotes,backlog,medium,2,EPIC-WIKI-02,,,"As an architect, I want to insert block quotes so that I can highlight important statements or quotes."
User Story,US-WIKI-009,Page Metadata Tracking,backlog,high,2,EPIC-WIKI-01,,,"As an architect, I want wiki pages to track created_by, created_at, updated_by, updated_at metadata so that I know the history of each document."
User Story,US-WIKI-010,Search Wiki Pages,backlog,high,5,EPIC-WIKI-01,,,"As an architect, I want to search wiki pages by title and content so that I can quickly find specific information."
User Story,US-WIKI-011,TipTap Editor Implementation,backlog,high,8,EPIC-WIKI-02,,,"As an architect, I want a modern block-based editor using TipTap so that I can create rich documentation easily."
User Story,US-WIKI-012,Markdown Shortcuts,backlog,high,5,EPIC-WIKI-02,,,"As an architect, I want to use markdown shortcuts like # for H1, ## for H2, - for bullet lists so that I can format content quickly."
User Story,US-WIKI-013,Slash Commands,backlog,high,8,EPIC-WIKI-02,,,"As an architect, I want to use slash commands (/) to insert blocks so that I can quickly add headings, tables, code blocks, and more."
User Story,US-WIKI-014,Insert Headings,backlog,high,3,EPIC-WIKI-02,,,"As an architect, I want to insert headings (H1, H2, H3) so that I can structure my documentation hierarchically."
User Story,US-WIKI-015,Create Lists,backlog,high,3,EPIC-WIKI-02,,,"As an architect, I want to create bullet lists and numbered lists so that I can organize information clearly."
User Story,US-WIKI-017,Insert Tables,backlog,medium,5,EPIC-WIKI-02,,,"As an architect, I want to insert tables so that I can present structured data in my documentation."
User Story,US-WIKI-018,Insert Images,backlog,medium,5,EPIC-WIKI-02,,,"As an architect, I want to insert images via upload or URL so that I can include diagrams and screenshots in my documentation."
User Story,US-WIKI-019,Text Formatting,backlog,high,3,EPIC-WIKI-02,,,"As an architect, I want to apply text formatting (bold, italic, underline, strikethrough) so that I can emphasize important information."
User Story,US-WIKI-022,Drag-and-Drop Blocks,backlog,medium,5,EPIC-WIKI-02,,,"As an architect, I want to drag-and-drop blocks to reorder them so that I can easily reorganize my content."
User Story,US-WIKI-023,Keyboard Shortcuts,backlog,high,3,EPIC-WIKI-02,,,"As an architect, I want to use keyboard shortcuts (Cmd/Ctrl+B for bold, etc.) so that I can format content efficiently."
User Story,US-WIKI-024,Tree View Sidebar,backlog,high,8,EPIC-WIKI-03,,,"As an architect, I want a tree view sidebar showing page hierarchy so that I can navigate my documentation structure."
User Story,US-WIKI-025,Expand/Collapse Folders,backlog,high,3,EPIC-WIKI-03,,,"As an architect, I want to expand and collapse folders in the tree view so that I can focus on relevant sections."
User Story,US-WIKI-026,Drag-and-Drop Pages in Tree,backlog,medium,5,EPIC-WIKI-03,,,"As an architect, I want to drag-and-drop pages to reorganize the hierarchy so that I can restructure my documentation easily."
User Story,US-WIKI-028,Create Folders,backlog,medium,5,EPIC-WIKI-03,,,"As an architect, I want to create folders to organize pages so that I can group related documentation."
User Story,US-WIKI-029,Highlight Active Page,backlog,high,2,EPIC-WIKI-03,,,"As an architect, I want the active page to be highlighted in the tree view so that I always know where I am."
User Story,US-WIKI-030,Context Menu on Pages,backlog,high,5,EPIC-WIKI-03,,,"As an architect, I want to right-click on pages in the tree view to access actions so that I can quickly perform operations."
User Story,US-WIKI-031,Collapsible Sidebar,backlog,medium,3,EPIC-WIKI-03,,,"As an architect, I want to collapse the tree view sidebar so that I can maximize editor space when needed."
User Story,US-WIKI-032,@ Mention Picker Trigger,backlog,critical,8,EPIC-WIKI-04,,,"As an architect, I want to type @ to trigger a mention picker so that I can link to platform entities."
User Story,US-WIKI-033,Search User Stories in Mentions,backlog,critical,5,EPIC-WIKI-04,,,"As an architect, I want to search and mention User Stories from the Plan module so that I can link documentation to implementation."
User Story,US-WIKI-036,Search Diagrams in Mentions,backlog,high,5,EPIC-WIKI-04,,,"As an architect, I want to search and mention Diagrams from the Canvas module so that I can reference visual architecture."
User Story,US-WIKI-037,Search Wiki Pages in Mentions,backlog,high,3,EPIC-WIKI-04,,,"As an architect, I want to search and mention other Wiki pages so that I can cross-reference documentation."
User Story,US-WIKI-038,Search Requirements in Mentions,backlog,medium,3,EPIC-WIKI-04,,,"As an architect, I want to search and mention Requirements so that I can trace decisions back to requirements."
User Story,US-WIKI-039,Search ADRs in Mentions,backlog,medium,3,EPIC-WIKI-04,,,"As an architect, I want to search and mention Architecture Decision Records so that I can reference key decisions."
User Story,US-WIKI-040,Search Users/Teams in Mentions,backlog,medium,5,EPIC-WIKI-04,,,"As an architect, I want to mention users and teams so that I can reference people and notify them."
User Story,US-WIKI-041,Render Mentions as Colored Chips,backlog,critical,5,EPIC-WIKI-04,,,"As an architect, I want mentions to render as colored chips so that I can visually distinguish entity types."
User Story,US-WIKI-042,Status-Aware Mention Colors,backlog,critical,5,EPIC-WIKI-04,,,"As an architect, I want mention colors to indicate entity status so that I can see if components are active, deprecated, or sunset."
User Story,US-WIKI-043,Hover Preview Card,backlog,high,8,EPIC-WIKI-04,,,"As an architect, I want to see a preview card when hovering over mentions so that I can quickly understand the entity without navigating."
User Story,US-WIKI-044,Navigate by Clicking Mention,backlog,critical,3,EPIC-WIKI-04,,,"As an architect, I want to click on mentions to navigate to the entity so that I can explore the architecture."
User Story,US-WIKI-045,Real-Time Status Updates,backlog,high,8,EPIC-WIKI-04,,,"As an architect, I want mentions to reflect entity status changes in real-time so that my documentation stays current."
User Story,US-WIKI-046,Store Mentions as Structured Data,backlog,critical,5,EPIC-WIKI-04,,,"As a system, I need to store mentions as structured data so that backlinks and queries are possible."
User Story,US-WIKI-049,Show Wiki Mentions on User Stories,backlog,high,3,EPIC-WIKI-05,,,"As a PM or developer, I want to see which wiki pages mention a user story so that I can find context and requirements."
User Story,US-WIKI-050,Navigate via Backlinks,backlog,high,2,EPIC-WIKI-05,,,"As an architect, I want to click on backlinks to navigate and see the mention in context."
User Story,US-WIKI-051,Show Snippets with Context,backlog,medium,5,EPIC-WIKI-05,,,"As an architect, I want backlinks to show snippets of surrounding text so that I can understand the context without opening the page."
User Story,US-WIKI-052,Filter Backlinks by Page Type,backlog,low,3,EPIC-WIKI-05,,,"As an architect, I want to filter backlinks by page type (ADR, Design Doc, etc.) so that I can focus on specific documentation."
User Story,US-WIKI-053,Create Requirement Pages from Template,backlog,high,8,EPIC-WIKI-06,,,"As an architect, I want to create Requirement pages using a template so that requirements are consistently documented."
User Story,US-WIKI-054,Set Requirement Identifier,backlog,high,5,EPIC-WIKI-06,,,"As an architect, I want to assign a unique identifier to each requirement so that I can reference it consistently."
User Story,US-WIKI-055,Set Requirement Type,backlog,high,3,EPIC-WIKI-06,,,"As an architect, I want to categorize requirements as Business, Product, or Technical so that I can filter by type."
User Story,US-WIKI-056,Set Requirement Priority,backlog,high,2,EPIC-WIKI-06,,,"As an architect, I want to set requirement priority (High, Medium, Low) so that I can focus on critical requirements."
User Story,US-WIKI-057,Set Requirement Status,backlog,high,3,EPIC-WIKI-06,,,"As an architect, I want to track requirement status (Proposed, Accepted, Implemented, Deprecated) so that I know the lifecycle state."
User Story,US-WIKI-058,Write Narrative Requirement Description,backlog,high,5,EPIC-WIKI-06,,,"As an architect, I want to write narrative descriptions with rich text so that I can explain the business context and rationale."
